{
  "format": "aibt.tree",
  "formatVersion": 1,
  "treeId": "tree.samples.showcase-timed-sequence",
  "name": "Timed Sequence",
  "description": "Runs three tick-counted waits in order and then succeeds.",
  "root": "root",
  "nodes": {
    "root": {
      "type": "aibt.core.memory-sequence",
      "typeVersion": 1,
      "displayName": "Run steps in order",
      "children": ["prepare", "act", "settle"]
    },
    "prepare": {
      "type": "aibt.stdlib.wait",
      "typeVersion": 1,
      "displayName": "Prepare — 2 ticks",
      "parameters": { "ticks": 2 }
    },
    "act": {
      "type": "aibt.stdlib.wait",
      "typeVersion": 1,
      "displayName": "Act — 1 tick",
      "parameters": { "ticks": 1 }
    },
    "settle": {
      "type": "aibt.stdlib.wait",
      "typeVersion": 1,
      "displayName": "Settle — 3 ticks",
      "parameters": { "ticks": 3 }
    }
  }
}
