{
  "format": "aibt.tree",
  "formatVersion": 1,
  "treeId": "tree.samples.full-example-hot-reload",
  "name": "Full Example -- Hot Reload Pass (After -- compatible reorder)",
  "root": "root",
  "nodes": {
    "root": {
      "type": "aibt.core.memory-sequence",
      "typeVersion": 1,
      "children": [
        "wait",
        "check"
      ]
    },
    "check": {
      "type": "aibt.test.success",
      "typeVersion": 1
    },
    "wait": {
      "type": "aibt.test.running",
      "typeVersion": 1
    }
  }
}
