{
  "format": "aibt.tree",
  "formatVersion": 1,
  "treeId": "tree.test.layout-shallow-wide-4",
  "name": "Shallow Wide Four",
  "root": "root",
  "nodes": {
    "root": {
      "type": "sample.composite",
      "typeVersion": 1,
      "children": [
        "a",
        "b",
        "c",
        "d"
      ]
    },
    "a": {
      "type": "sample.leaf",
      "typeVersion": 1
    },
    "b": {
      "type": "sample.leaf",
      "typeVersion": 1
    },
    "c": {
      "type": "sample.leaf",
      "typeVersion": 1
    },
    "d": {
      "type": "sample.leaf",
      "typeVersion": 1
    }
  }
}
